Nông sản,Giá cũ,Giá mới,Thay đổi,Ngày thu thập
Hồ tiêu Đắk Lắk (đ/kg),141.000,141.000,Không đổi,2026-04-19
Hồ tiêu Gia Lai (đ/kg),140.000,140.000,Không đổi,2026-04-19
Hồ tiêu Đắk Nông (đ/kg),141.000,141.000,Không đổi,2026-04-19
Hồ tiêu Bà Rịa - Vũng Tàu (đ/kg),140.000,140.000,Không đổi,2026-04-19
Hồ tiêu Bình Phước (đ/kg),140.000,140.000,Không đổi,2026-04-19
Tiêu đen Indonesia (USD/tấn),7.065,7.043,"▼ -22 USD (-0,31%)",2026-04-19
Tiêu trắng Indonesia (USD/tấn),9.308,9.279,"▼ -29 USD (-0,31%)",2026-04-19
Tiêu trắng Malaysia ASTA (USD/tấn),12.200,12.200,Không đổi,2026-04-19
